{"architecture":"mlp","created_by":{"contract_version":"2.0","pmx_version":"2.0.0-dev"},"features_hash":"7077333ea0c18a0ad004a763dcd6574165e2d95b4d389f9e98b77de0a3d834be","features_version":"features.v1","inference_kind":"cpu_float32","model_id":"mc-53b6f7ad3cc215c4","n_parameters":74241,"notes":"Fixture card of amendment C1: the shape is normative, the numbers are not.","schema_version":"model_card.v1","train":{"algorithm":"ppo","dataset_hash":"72f0827fc83fe3dbe0184877a89531e61f01f3d8898dcd534e90320de94b21ce","dataset_name":"c1fixture","device":"cuda","fold":"train","framework":"torch","framework_version":"2.6.0","n_markets":612,"seeds":{"env":17,"init":4,"torch":17},"steps":200000,"t0_ms":1756684800000,"t1_ms":1772236800000},"validation":{"brier_tw_micro":184220,"fold":"validation","n_blocks":22,"n_markets":148,"pnl_lb_cents":-2100,"pnl_point_cents":31500,"resamples":10000,"skill_lb_micro":6900,"skill_point_micro":21400,"turnover_ppm":412000},"weights_bytes":1048576,"weights_sha256":"53b6f7ad3cc215c4eb2ff4bb3c18920e223814218c6bc60e805bc5e2c35bd616"}
